{
  "entry_id": "VID_CHAN_MARRIAGEINLIG_008",
  "topic": [
    "Marriage",
    "foundations"
  ],
  "sub_topic": null,
  "faith_perspective": "Christian",
  "source_type": "Article",
  "source_reference": {
    "text": "Video: 'Marriage In Light of Eternity | Francis Chan' by Francis Chan on Crazy Love Ministries (@CrazyLoveMinistries) (May 10, 2023 (from search result))",
    "url": "https://www.youtube.com/shorts/VSW6mdMb5Vg"
  },
  "content_summary": "Marriage In Light of Eternity | Francis Chan",
  "content_detailed": "(YouTube Short - No detailed description available on page)",
  "keywords": [
    "eternity",
    "foundations",
    "francis",
    "chan",
    "Marriage",
    "light",
    "marriage"
  ],
  "related_scripture": [],
  "related_entries": [],
  "qa_pairs": [],
  "instruction_response": [],
  "metadata": {
    "creation_date": "2025-05-02",
    "last_modified_date": "2025-05-02",
    "contributor": "Manus",
    "version": 1,
    "moderation_status": "Approved"
  }
}