{
  "entry_id": "VID_EVANS_LOVEISFOUNDI_007",
  "topic": [
    "Marriage",
    "communication",
    "love"
  ],
  "sub_topic": null,
  "faith_perspective": "Christian",
  "source_type": "Article",
  "source_reference": {
    "text": "Video: 'Love Is Found in Deeds\u2026 Not Words | Tony Evans Sermon Clip' by Dr. Tony Evans on Tony Evans (Apr 12, 2023)",
    "url": "https://www.youtube.com/watch?v=rAlbNbwl_N0"
  },
  "content_summary": "Love Is Found in Deeds\u2026 Not Words | Tony Evans Sermon Clip",
  "content_detailed": "Dr. Tony Evans explores the biblical principle that love is a choice, not merely an emotion or feeling. Join him as he challenges viewers to consider what it means to choose love in our relationships with others and the freedom that comes from living out this biblical principle.\nSUBSCRIBE: https://www.youtube.com/user/drtonyevans/videos?view=0&sort=p&flow=grid?sub_confirmation=1\nIf you would like to download two encouraging, FREE full-length MP3s of Tony's popular sermons: \"The Sovereignty of God\" and \"How to Handle a Crisis,\" you can do so by clicking on this link: https://share.hsforms.com/1atT9MJvXQN...\nIf you would like to sign up for our daily devotional bringing you hope and inspiration, please go to this link: https://share.hsforms.com/1CkOLA910Sm...\n\u25b6 Do you know Jesus as your Savior? https://tonyevans.org/know-jesus-christ/\n\u25b6 Stream Sermons: https://tonyevans.org/podcast/\n\u25b6\u25b6 Free Sermon App: https://subsplash.com/tonyevans/app/\n\u25b6\u25b6 DONATE: https://give.tonyevans.org/the-alternative-donation-form-2/\n\u25b6 Facebook: / drtonyevans\n\u25b6 Instagram: / drtonyevans\n\u25b6 Are you a preacher? Free sermon outlines: https://go.tonyevans.org/dr-tony-evans-free-sermon-outlines\nDr. Tony Evans is the founder and senior pastor of Oak Cliff Bible Fellowship in Dallas, founder and president of The Urban Alternative and author of over 100 books, booklets and Bible studies. The first African American to earn a doctorate of theology from Dallas Theological Seminary, he has been named one of the 12 Most Effective Preachers in the English-Speaking World by Baylor University. Dr. Evans holds the honor of writing and publishing the first full-Bible commentary and study Bible by an African American. His radio broadcast, The Alternative with Dr. Tony Evans, can be heard on over 1,400 radio outlets daily and in more than 130 countries. Dr. Evans\u2019 sermons are also streamed and downloaded over 20,000,000 times annually.\n#tonyevans #tonyevanssermon #Love",
  "keywords": [
    "tony",
    "found",
    "evans",
    "love",
    "Marriage",
    "clip",
    "sermon",
    "words",
    "deeds\u2026",
    "communication"
  ],
  "related_scripture": [],
  "related_entries": [],
  "qa_pairs": [],
  "instruction_response": [],
  "metadata": {
    "creation_date": "2025-05-02",
    "last_modified_date": "2025-05-02",
    "contributor": "Manus",
    "version": 1,
    "moderation_status": "Approved"
  }
}