{
  "entry_id": "VID_MUNROE_THEPRIORITYOF_003",
  "topic": [
    "Marriage",
    "communication",
    "culture",
    "foundations"
  ],
  "sub_topic": null,
  "faith_perspective": "Christian",
  "source_type": "Article",
  "source_reference": {
    "text": "Video: 'The Priority of Culture In Relationships Part 2 | Dr. Myles Munroe' by Dr. Myles Munroe on Munroe Global (Jul 24, 2019)",
    "url": "https://www.youtube.com/watch?v=nmAP12VR-0g&list=PLiSxXTy3ZWc69WmbbnQge2GurWXfItr6m&index=3"
  },
  "content_summary": "The Priority of Culture In Relationships Part 2 | Dr. Myles Munroe",
  "content_detailed": "You can purchase the complete album via the link below. Available on CD, DVD, MP3 & MP4\nhttp://bit.ly/KCIoRVol2\n\nKingdom Culture Influence Of Relationships Volume 2 Titles:\nDisc 1 \u2013 The Priority Of Culture In Relationships Part 1\nDisc 2 \u2013 The Priority Of Culture In Relationships Part 2\nDisc 3 \u2013 The Priority Of Culture In Relationships Part 3\n\nDr. Myles Munroe speaks on how The Kingdom of God and its government should positively affect those that come in contact with it. What is the Kingdom of God? Where is it located? How will we know that it is here? The answer is, The Kingdom does not come through observation but through relationships.\n\n#drmylesmunroe #mylesmunroe",
  "keywords": [
    "myles",
    "foundations",
    "part",
    "munroe",
    "priority",
    "Marriage",
    "relationships",
    "culture",
    "communication"
  ],
  "related_scripture": [],
  "related_entries": [],
  "qa_pairs": [],
  "instruction_response": [],
  "metadata": {
    "creation_date": "2025-05-02",
    "last_modified_date": "2025-05-02",
    "contributor": "Manus",
    "version": 1,
    "moderation_status": "Approved"
  }
}