{
  "entry_id": "VID_CHAPMAN_5TIPSFORAS_006",
  "topic": [
    "Marriage",
    "general_advice",
    "communication",
    "love",
    "parenting",
    "intimacy"
  ],
  "sub_topic": null,
  "faith_perspective": "Christian",
  "source_type": "Article",
  "source_reference": {
    "text": "Video: '\"5 Tips for a Successful Marriage\" Dr. Gary Chapman' by Dr. Gary Chapman on 100huntley (Jan 8, 2018)",
    "url": "https://www.youtube.com/watch?v=AHn635YwxSw"
  },
  "content_summary": "\"5 Tips for a Successful Marriage\" Dr. Gary Chapman",
  "content_detailed": "Gary's Chapman's \"Things I Wish I'd Known Before We Got Married [book]\" is available at https://amzn.to/2wKLC9c\nGary's Chapman's \"The 5 Love Languages: The Secret to Love that Lasts [book]\" is available at https://amzn.to/3ctithY\nGary's Chapman's \"The 5 Love Languages for Men: Tools for Making a Good Relationship Great [book]\" is available at https://amzn.to/2Kc82Dl\nGary's Chapman's \"The 5 Love Languages Singles Edition: The Secret that Will Revolutionize Your Relationships [book]\" is available at https://amzn.to/2Vg9H1d\nGary's Chapman's \"The 5 Love Languages of Children: The Secret to Loving Children Effectively [book]\" is available at https://amzn.to/3bjfCIr\n\nNeed prayer? Our Prayer Line services 1-866-273-4444 are available toll-free 24/7. Or you can submit your prayer requests online http://100hs.ca/prayer\nWe also offer extended assistance to those in need.\n\nClick here if you're interested in subscribing: http://100hs.ca/subscribe\nConnect with 100 Huntley Street Online:\n\u2022 Facebook: / 100huntley\n\u2022 Twitter: / 100huntley\n\u2022 Instagram: / 100huntley\n\nAbout 100 Huntley Street\u2122: http://100huntley.com\nLooking for a daily show that will encourage and inspire your Christian faith? Every day at 12 noon EST 100 Huntley Street brings you the amazing stories of people \u2013 whether they be world leaders, celebrities, sports figures, or everyday people \u2013 who have had life-changing encounters with God.\n\n100 Huntley Street is a production of Crossroads Christian Communications Inc. This program is funded by the generous support of viewers. To donate or to become a monthly partner visit https://donate.crossroads.ca/\n\nAbout Castle\u2122: http://intothecastle.com\nCastle is home to hundreds of television shows, documentaries, movies, including all Crossroads productions like See Hear Love, Context Beyond the Headlines, and 100 Huntley Street. One of the unique features of Castle is the ability to chat in real-time with a digital pastor. Castle is 100% FREE for all.",
  "keywords": [
    "marriage\"",
    "general_advice",
    "intimacy",
    "communication",
    "successful",
    "love",
    "Marriage",
    "tips",
    "parenting",
    "chapman",
    "gary"
  ],
  "related_scripture": [],
  "related_entries": [],
  "qa_pairs": [],
  "instruction_response": [],
  "metadata": {
    "creation_date": "2025-05-02",
    "last_modified_date": "2025-05-02",
    "contributor": "Manus",
    "version": 1,
    "moderation_status": "Approved"
  }
}